{"authority_authenticated":false,"authorization":{"activation":false,"egress":false,"execution":false,"installation":false,"mutation":false,"publication":false},"benefit_supported":false,"candidates":[{"binding_review":"not_performed","candidate_id":"JEV-35BF42296433","estimates":{"added_cost":null,"added_latency_ms":null,"calls_per_task":null,"complexity":null,"failure_reduction":null,"false_negative_rate":null,"false_positive_rate":null,"maintenance":null,"model_call_reduction":null,"provenance":null,"quality_gain":null,"reliability_gain":null,"risk":null,"throughput":null},"implementation_verified":false,"missing_estimates":["quality_gain","reliability_gain","failure_reduction","model_call_reduction","added_latency_ms","added_cost","calls_per_task","complexity","maintenance","false_positive_rate","false_negative_rate","risk","throughput"],"pattern":"C","reasons":["binding_preparation_and_separate_mutation_approval_required"],"seam_id":"8b63378bb40c6ed6ce729f18928a4aaee3801bbe45a3a0dd81ea58defa0809aa","source":{"end_line":5,"file":"opaque.py","file_sha256":"b5e09a154d2b60b3663f7318390e8e01ef751c7eb307c653aa3d1a006c3de835","source_sha256":"910422302b122c09d4cc8f28e4cc654c57facf04c6809e4283bec29e15e498ee","start_line":4,"symbol":"q"},"state":"experimental_review_required"}],"conflicts":[],"context_sha256":"9664f9fd5e40fbb091aca6a51a8cbada857446fbd090eda157f225624e94d313","contract":"repository-placement-context-v1","coverage_complete_within_policy":true,"excluded_entries":0,"experimental_candidate_ids":["JEV-35BF42296433"],"next_action":"review_explicit_experimental_selection","optimization":{"benefit_supported":false,"declared_model_status":"no_justified_integration_set","eligible_candidates":0,"no_useful_placement_inferred":false,"status":"insufficient_estimates"},"outcome":"experimental_review_required","policy_sha256":"75b0528474704c8b202c04cdc1d532bcabc286357b23af2d66c21acba769781c","prepared_sha256":"8a56088614bc812224c926f7f5b70b24a83e29387aa7329676146541ceea9579","report_sha256":"dcae1a45c89028d6709c40097ed2c559225603a99b6029b5bb54141fef9ef060","reviewed_sha256":"dd353d824a12e4d1ec19812102986fe0f9d819dcba7fd7c05d68ba83de4eb605","runtime_mode":"off","schema_version":"1.0","scope_review":{"complete":false,"files_reviewed":0,"files_total":1,"missing_files":["opaque.py"],"missing_seams":["39b4909fde86aa80b8ab3d638956c3d0946326d92324573bc711af0fa8d0fa41","8b63378bb40c6ed6ce729f18928a4aaee3801bbe45a3a0dd81ea58defa0809aa"],"no_useful_judgment":false,"provided":false,"review_sha256":null,"seams_reviewed":0,"seams_total":2,"unresolved":0,"useful":0},"selection_engine_sha256":"7093575732f1b2f9be7d741a5f56bc27a06b05180fcf1468954bf62a737d7030","semantic_review_sha256":"70709d85b5d126f738af35a08bc4577efe18b311ad3be93dcbdd1c59017b141e","settings_sha256":"1843a4a1d66bdf1b68221850c7f5a8c7a81d5608cf52c65a1b89b23db95e60af","snapshot_scope":"bounded_source_and_configuration_not_full_repository"}
